{"schema_version":1,"source":{"id":"black-buzzard","adapter":"html-buzzard"},"venue":{"key":"black-buzzard","name":"The Black Buzzard","timezone":"America/Denver","address":"1624 Market St, Denver, CO 80202","website":"https://www.theblackbuzzard.com/event-calendar","admission_policy":{"text":"18+ unless otherwise posted; ID required","url":"https://www.theblackbuzzard.com/faq","category":"18+"}},"generated_at":"2026-09-12T17:41:05.843Z","coverage":{"from":"2026-09-12","through":"2027-09-12","complete":true},"events":[{"status":"Scheduled","date":"2026-09-19","title":"Ryman Leon, Sam Nicholson","event_url":"https://tixr.com/e/184485","ticket_url":"https://tixr.com/e/184485","id":"black-buzzard-28b0b7c35f36","upstream_id":"184485","public_path":"/events/black-buzzard/2026-09-19-ryman-leon-sam-nicholson-28b0b7c35f36","off_site":false,"listed":true,"expires_on":"2026-12-18"},{"status":"Scheduled","date":"2026-11-06","title":"BandWagon Battle of the Bands (Denver Preliminary #1)","event_url":"https://tixr.com/e/206176","ticket_url":"https://tixr.com/e/206176","id":"black-buzzard-2b2d1ab94138","upstream_id":"206176","public_path":"/events/black-buzzard/2026-11-06-bandwagon-battle-of-the-bands-denver-preliminary-1-2b2d1ab94138","off_site":false,"listed":true,"expires_on":"2027-02-04"},{"status":"Scheduled","date":"2026-10-02","title":"Parrotfish, Junkyard Cat, The Yeah Dawgs","event_url":"https://tixr.com/e/198453","ticket_url":"https://tixr.com/e/198453","id":"black-buzzard-421dac3f345c","upstream_id":"198453","public_path":"/events/black-buzzard/2026-10-02-parrotfish-junkyard-cat-the-yeah-dawgs-421dac3f345c","off_site":false,"listed":true,"expires_on":"2026-12-31"},{"status":"Scheduled","date":"2026-09-12","title":"John Caparulo - Stand Up Comedy (Night 2 - Matinee)","event_url":"https://tixr.com/e/192157","ticket_url":"https://tixr.com/e/192157","id":"black-buzzard-48ca4e4a7be1","upstream_id":"192157","public_path":"/events/black-buzzard/2026-09-12-john-caparulo-stand-up-comedy-night-2-matinee-48ca4e4a7be1","off_site":false,"listed":true,"expires_on":"2026-12-11"},{"status":"Scheduled","date":"2026-09-26","title":"Cory Branan, Jon Snodgrass, First Born","event_url":"https://tixr.com/e/194226","ticket_url":"https://tixr.com/e/194226","id":"black-buzzard-5675d76cd61f","upstream_id":"194226","public_path":"/events/black-buzzard/2026-09-26-cory-branan-jon-snodgrass-first-born-5675d76cd61f","off_site":false,"listed":true,"expires_on":"2026-12-25"},{"status":"Scheduled","date":"2026-12-05","title":"Tim Butterly - Late Show (Denver)","event_url":"https://tixr.com/e/189242","ticket_url":"https://tixr.com/e/189242","id":"black-buzzard-5884ba7434f3","upstream_id":"189242","public_path":"/events/black-buzzard/2026-12-05-tim-butterly-late-show-denver-5884ba7434f3","off_site":false,"listed":true,"expires_on":"2027-03-05"},{"status":"Scheduled","date":"2026-09-25","title":"Johnny Manchild \u0026 The Poor Bastards, Friend of a Friend, Karma \u0026 The Killjoys","event_url":"https://tixr.com/e/188669","ticket_url":"https://tixr.com/e/188669","id":"black-buzzard-5e2704f4bf79","upstream_id":"188669","public_path":"/events/black-buzzard/2026-09-25-johnny-manchild-the-poor-bastards-friend-of-a-friend-karma-the-killjoys-5e2704f4bf79","off_site":false,"listed":true,"expires_on":"2026-12-24"},{"status":"Scheduled","date":"2026-10-16","title":"Big Shrimp, Dr Lunch","event_url":"https://tixr.com/e/199981","ticket_url":"https://tixr.com/e/199981","id":"black-buzzard-8efae6a96c3a","upstream_id":"199981","public_path":"/events/black-buzzard/2026-10-16-big-shrimp-dr-lunch-8efae6a96c3a","off_site":false,"listed":true,"expires_on":"2027-01-14"},{"status":"Scheduled","date":"2026-12-05","title":"Tim Butterly - Early Show (Denver)","event_url":"https://tixr.com/e/189241","ticket_url":"https://tixr.com/e/189241","id":"black-buzzard-988219d3049a","upstream_id":"189241","public_path":"/events/black-buzzard/2026-12-05-tim-butterly-early-show-denver-988219d3049a","off_site":false,"listed":true,"expires_on":"2027-03-05"},{"status":"Scheduled","date":"2026-11-13","title":"BandWagon Battle of the Bands (Denver Preliminary #2)","event_url":"https://tixr.com/e/206178","ticket_url":"https://tixr.com/e/206178","id":"black-buzzard-aac117fb0f13","upstream_id":"206178","public_path":"/events/black-buzzard/2026-11-13-bandwagon-battle-of-the-bands-denver-preliminary-2-aac117fb0f13","off_site":false,"listed":true,"expires_on":"2027-02-11"},{"status":"Scheduled","date":"2026-10-18","title":"Intuition \u0026 Equalibrum, Speak!, Black Salt, BRY444N","event_url":"https://tixr.com/e/199735","ticket_url":"https://tixr.com/e/199735","id":"black-buzzard-bad35f1d08ae","upstream_id":"199735","public_path":"/events/black-buzzard/2026-10-18-intuition-equalibrum-speak-black-salt-bry444n-bad35f1d08ae","off_site":false,"listed":true,"expires_on":"2027-01-16"},{"status":"Scheduled","date":"2026-10-17","title":"Hippies \u0026 Cowboys","event_url":"https://tixr.com/e/201654","ticket_url":"https://tixr.com/e/201654","id":"black-buzzard-c466b92a31d6","upstream_id":"201654","public_path":"/events/black-buzzard/2026-10-17-hippies-cowboys-c466b92a31d6","off_site":false,"listed":true,"expires_on":"2027-01-15"},{"status":"Scheduled","date":"2026-10-03","title":"Summoner's Circle, IATT, Gravewitch (Denver)","event_url":"https://tixr.com/e/198010","ticket_url":"https://tixr.com/e/198010","id":"black-buzzard-e4ddf18180ab","upstream_id":"198010","public_path":"/events/black-buzzard/2026-10-03-summoner-s-circle-iatt-gravewitch-denver-e4ddf18180ab","off_site":false,"listed":true,"expires_on":"2027-01-01"}]}
