{"schema_version":1,"source":{"id":"fiddlers-green","adapter":"aeg-json"},"venue":{"key":"fiddlers-green","name":"Fiddler's Green Amphitheatre","timezone":"America/Denver","website":"https://www.fiddlersgreenamp.com"},"generated_at":"2026-09-13T20:46:47.348Z","coverage":{"from":"2026-09-13","through":"2027-09-13","complete":true},"events":[{"status":"Buy Tickets","date":"2026-09-25","title":"$UICIDEBOY$","performers":["$UICIDEBOY$"],"doors_at":"2026-09-25T17:00:00-06:00","show_at":"2026-09-25T18:00:00-06:00","admission_policy":{"with_adult":{"url":"https://www.fiddlersgreenamp.com/policies/","reviewed_on":"2026-09-09","ranges":[{"min_age":0,"max_age":1,"condition":"Permitted at this age; check event ticket requirements"},{"min_age":2,"max_age":17,"condition":"Ticket generally required from age 2"}]},"text":"All Ages","category":"All ages"},"event_url":"https://www.fiddlersgreenamp.com/events/detail?event_id=1385230","ticket_url":"https://www.axs.com/events/1385230/uicideboy-tickets","id":"fiddlers-green-4e015a68038e","upstream_id":"1385230","public_path":"/events/fiddlers-green/2026-09-25-uicideboy-4e015a68038e","off_site":false,"listed":true,"expires_on":"2026-12-24"},{"status":"Buy Tickets","date":"2026-09-12","title":"Rob Zombie \u0026 Marilyn Manson","performers":["Rob Zombie \u0026 Marilyn Manson"],"doors_at":"2026-09-12T17:00:00-06:00","show_at":"2026-09-12T18:30:00-06:00","admission_policy":{"with_adult":{"url":"https://www.fiddlersgreenamp.com/policies/","reviewed_on":"2026-09-09","ranges":[{"min_age":0,"max_age":1,"condition":"Permitted at this age; check event ticket requirements"},{"min_age":2,"max_age":17,"condition":"Ticket generally required from age 2"}]},"text":"All Ages","category":"All ages"},"event_url":"https://www.fiddlersgreenamp.com/events/detail?event_id=1289187","ticket_url":"https://www.axs.com/events/1289187/rob-zombie-marilyn-manson-tickets","id":"fiddlers-green-68944b4491e7","upstream_id":"1289187","public_path":"/events/fiddlers-green/2026-09-12-rob-zombie-marilyn-manson-68944b4491e7","off_site":false,"listed":true,"expires_on":"2026-12-11"},{"status":"Buy Tickets","date":"2026-09-10","title":"Riley Green","performers":["Riley Green"],"doors_at":"2026-09-10T17:00:00-06:00","show_at":"2026-09-10T18:30:00-06:00","admission_policy":{"with_adult":{"url":"https://www.fiddlersgreenamp.com/policies/","reviewed_on":"2026-09-09","ranges":[{"min_age":0,"max_age":1,"condition":"Permitted at this age; check event ticket requirements"},{"min_age":2,"max_age":17,"condition":"Ticket generally required from age 2"}]},"text":"All Ages","category":"All ages"},"event_url":"https://www.fiddlersgreenamp.com/events/detail?event_id=1385231","ticket_url":"https://www.axs.com/events/1385231/riley-green-tickets","id":"fiddlers-green-a2322ef3c33d","upstream_id":"1385231","public_path":"/events/fiddlers-green/2026-09-10-riley-green-a2322ef3c33d","off_site":false,"listed":true,"expires_on":"2026-12-09"},{"status":"Buy Tickets","date":"2027-06-05","title":"Stick Figure","performers":["Stick Figure"],"doors_at":"2027-06-05T17:00:00-06:00","show_at":"2027-06-05T18:00:00-06:00","event_url":"https://www.fiddlersgreenamp.com/events/detail?event_id=1471576","ticket_url":"https://www.axs.com/events/1471576/stick-figure-tickets","id":"fiddlers-green-bff7e37ba45b","upstream_id":"1471576","public_path":"/events/fiddlers-green/2027-06-05-stick-figure-bff7e37ba45b","off_site":false,"listed":true,"expires_on":"2027-09-03"}]}
