{"schema_version":1,"source":{"id":"black-sky","adapter":"spothopper-events"},"venue":{"key":"black-sky","name":"Black Sky Brewery","timezone":"America/Denver","address":"490 Santa Fe Drive, Denver, CO 80204","phone":"(720) 708-5816","website":"https://blackskydenver.com/denver-santa-fe-arts-district-black-sky-brewery-events"},"generated_at":"2026-10-03T22:23:54.812Z","coverage":{"from":"2026-10-03","through":"2027-10-03","complete":true},"events":[{"status":"Scheduled","date":"2026-10-18","title":"Pumpkin Carving Night","show_at":"2026-10-18T16:00:00-06:00","admission_policy":{"text":"All Ages","url":"https://blackskydenver.com/denver-santa-fe-arts-district-black-sky-brewery-events","category":"All ages"},"event_url":"https://blackskydenver.com/denver-santa-fe-arts-district-black-sky-brewery-events","id":"black-sky-0c77340a4338","upstream_id":"3456305","public_path":"/events/black-sky/2026-10-18-pumpkin-carving-night-0c77340a4338","off_site":false,"listed":true,"expires_on":"2027-01-16"},{"status":"Scheduled","date":"2026-11-26","title":"Thanksgiving","show_at":"2026-11-26T11:00:00-07:00","event_url":"https://blackskydenver.com/denver-santa-fe-arts-district-black-sky-brewery-events","id":"black-sky-50f415d6c6e9","upstream_id":"2416701","public_path":"/events/black-sky/2026-11-26-thanksgiving-50f415d6c6e9","off_site":false,"listed":true,"expires_on":"2027-02-24"},{"status":"Scheduled","date":"2027-01-16","title":"Rhiannon's 50th Birthday Bash","show_at":"2027-01-16T20:00:00-07:00","event_url":"https://blackskydenver.com/denver-santa-fe-arts-district-black-sky-brewery-events","id":"black-sky-73ab3d81cc74","upstream_id":"3429873","public_path":"/events/black-sky/2027-01-16-rhiannon-s-50th-birthday-bash-73ab3d81cc74","off_site":false,"listed":true,"expires_on":"2027-04-16"},{"status":"Scheduled","date":"2026-10-10","title":"13 YEAR ANNIVERSARY","show_at":"2026-10-10T18:00:00-06:00","admission_policy":{"text":"Ages 18+","url":"https://blackskydenver.com/denver-santa-fe-arts-district-black-sky-brewery-events","category":"18+"},"event_url":"https://blackskydenver.com/denver-santa-fe-arts-district-black-sky-brewery-events","id":"black-sky-7c8a0b00afe4","upstream_id":"3213295","public_path":"/events/black-sky/2026-10-10-13-year-anniversary-7c8a0b00afe4","off_site":false,"listed":true,"expires_on":"2027-01-08"},{"status":"Scheduled","date":"2026-10-09","title":"Kal-El Astral Voyaging 2026 North American Tour","doors_at":"2026-10-09T18:00:00-06:00","show_at":"2026-10-09T19:00:00-06:00","admission_policy":{"text":"All Ages","url":"https://blackskydenver.com/denver-santa-fe-arts-district-black-sky-brewery-events","category":"All ages"},"event_url":"https://blackskydenver.com/denver-santa-fe-arts-district-black-sky-brewery-events","ticket_url":"https://tickets.holdmyticket.com/tickets/461713","id":"black-sky-80111059dace","upstream_id":"3040484","public_path":"/events/black-sky/2026-10-09-kal-el-astral-voyaging-2026-north-american-tour-80111059dace","off_site":false,"listed":true,"expires_on":"2027-01-07"},{"status":"Scheduled","date":"2026-10-31","title":"Halloween Party","show_at":"2026-10-31T18:00:00-06:00","admission_policy":{"text":"Ages 18+","url":"https://blackskydenver.com/denver-santa-fe-arts-district-black-sky-brewery-events","category":"18+"},"event_url":"https://blackskydenver.com/denver-santa-fe-arts-district-black-sky-brewery-events","id":"black-sky-8a105907ece2","upstream_id":"3315530","public_path":"/events/black-sky/2026-10-31-halloween-party-8a105907ece2","off_site":false,"listed":true,"expires_on":"2027-01-29"},{"status":"Scheduled","date":"2026-10-13","title":"Dog Party -  Record Thieves- Life Lately","show_at":"2026-10-13T18:00:00-06:00","admission_policy":{"text":"All Ages","url":"https://blackskydenver.com/denver-santa-fe-arts-district-black-sky-brewery-events","category":"All ages"},"event_url":"https://blackskydenver.com/denver-santa-fe-arts-district-black-sky-brewery-events","ticket_url":"https://tickets.holdmyticket.com/tickets/462407","id":"black-sky-91f19633e2da","upstream_id":"3175541","public_path":"/events/black-sky/2026-10-13-dog-party-record-thieves-life-lately-91f19633e2da","off_site":false,"listed":true,"expires_on":"2027-01-11"},{"status":"Scheduled","date":"2026-10-16","title":"Yard Crashers - Timeline - Inhara","doors_at":"2026-10-16T17:00:00-06:00","show_at":"2026-10-16T18:00:00-06:00","event_url":"https://blackskydenver.com/denver-santa-fe-arts-district-black-sky-brewery-events","id":"black-sky-b5b29cde832b","upstream_id":"3456302","public_path":"/events/black-sky/2026-10-16-yard-crashers-timeline-inhara-b5b29cde832b","off_site":false,"listed":true,"expires_on":"2027-01-14"},{"status":"Scheduled","date":"2026-12-31","title":"New Year's Eve","show_at":"2026-12-31T11:00:00-07:00","event_url":"https://blackskydenver.com/denver-santa-fe-arts-district-black-sky-brewery-events","id":"black-sky-bd5e28e3ea26","upstream_id":"2523128","public_path":"/events/black-sky/2026-12-31-new-year-s-eve-bd5e28e3ea26","off_site":false,"listed":true,"expires_on":"2027-03-31"},{"status":"Scheduled","date":"2026-10-24","title":"Humane Colorado Charity Drive","show_at":"2026-10-24T17:00:00-06:00","admission_policy":{"text":"All Ages","url":"https://blackskydenver.com/denver-santa-fe-arts-district-black-sky-brewery-events","category":"All ages"},"event_url":"https://blackskydenver.com/denver-santa-fe-arts-district-black-sky-brewery-events","id":"black-sky-c190dc21fca1","upstream_id":"3341082","public_path":"/events/black-sky/2026-10-24-humane-colorado-charity-drive-c190dc21fca1","off_site":false,"listed":true,"expires_on":"2027-01-22"},{"status":"Scheduled","date":"2026-11-27","title":"Noise for Toys Rock \u0026 Roll Toy Drive","show_at":"2026-11-27T18:00:00-07:00","admission_policy":{"text":"All Ages","url":"https://blackskydenver.com/denver-santa-fe-arts-district-black-sky-brewery-events","category":"All ages"},"event_url":"https://blackskydenver.com/denver-santa-fe-arts-district-black-sky-brewery-events","id":"black-sky-c8766c78de45","upstream_id":"3470773","public_path":"/events/black-sky/2026-11-27-noise-for-toys-rock-roll-toy-drive-c8766c78de45","off_site":false,"listed":true,"expires_on":"2027-02-25"},{"status":"Scheduled","date":"2026-12-25","title":"Christmas","show_at":"2026-12-25T11:00:00-07:00","event_url":"https://blackskydenver.com/denver-santa-fe-arts-district-black-sky-brewery-events","id":"black-sky-fbff3d3ee499","upstream_id":"2500022","public_path":"/events/black-sky/2026-12-25-christmas-fbff3d3ee499","off_site":false,"listed":true,"expires_on":"2027-03-25"}]}
