{"schema_version":1,"source":{"id":"ante-up","adapter":"html-anteup"},"venue":{"key":"ante-up","name":"Ante Up!","timezone":"America/Denver","address":"2130 S Platte River Dr, Denver, CO 80223","website":"https://www.anteupdenver.com/events-1","admission_policy":{"text":"All ages; sober community space","url":"https://www.anteupdenver.com/venue","category":"All ages"}},"generated_at":"2026-10-03T01:14:17.829Z","coverage":{"from":"2026-10-02","through":"2027-10-02","complete":true},"events":[{"status":"Scheduled","date":"2026-10-18","title":"CAR SHOW + MAKERS' MARKET + MATINEE","admission_policy":{"with_adult":{"url":"https://www.anteupdenver.com/venue","reviewed_on":"2026-09-17","ranges":[{"min_age":0,"max_age":17,"condition":"Permitted at this age; sober space"}]},"text":"All ages; sober community space","url":"https://www.anteupdenver.com/venue","category":"All ages"},"event_url":"https://www.anteupdenver.com/events/car-show-makers-market-matinee","ticket_url":"https://www.anteupdenver.com/events/car-show-makers-market-matinee","id":"ante-up-0fc5e5d94a2e","upstream_id":"8cea30f5-8368-49d0-a9aa-2f6ea16d5ffd","public_path":"/events/ante-up/2026-10-18-car-show-makers-market-matinee-0fc5e5d94a2e","off_site":false,"listed":true,"expires_on":"2027-01-16"},{"status":"Scheduled","date":"2026-09-27","title":"PURIFIED","doors_at":"2026-09-27T18:00:00-06:00","show_at":"2026-09-27T18:30:00-06:00","admission_policy":{"with_adult":{"url":"https://www.anteupdenver.com/venue","reviewed_on":"2026-09-17","ranges":[{"min_age":0,"max_age":17,"condition":"Permitted at this age; sober space"}]},"text":"All ages; sober community space","url":"https://www.anteupdenver.com/venue","category":"All ages"},"event_url":"https://www.anteupdenver.com/events/purified","ticket_url":"https://www.anteupdenver.com/events/purified","id":"ante-up-1a2b7a84b6fd","upstream_id":"58665835-8cd8-44e5-9489-1ed79eaf2dbf","public_path":"/events/ante-up/2026-09-27-purified-1a2b7a84b6fd","off_site":false,"listed":true,"expires_on":"2026-12-26"},{"status":"Scheduled","date":"2026-10-11","title":"GRIDIRON (BOYERTOWN,PA)","doors_at":"2026-10-11T19:00:00-06:00","show_at":"2026-10-11T19:30:00-06:00","admission_policy":{"with_adult":{"url":"https://www.anteupdenver.com/venue","reviewed_on":"2026-09-17","ranges":[{"min_age":0,"max_age":17,"condition":"Permitted at this age; sober space"}]},"text":"All ages; sober community space","url":"https://www.anteupdenver.com/venue","category":"All ages"},"event_url":"https://www.anteupdenver.com/events/gridiron-boyertown-pa","ticket_url":"https://www.anteupdenver.com/events/gridiron-boyertown-pa","id":"ante-up-1b48f1f3217e","upstream_id":"eedca7bc-9bfc-4846-b4c2-904b7cd1978c","public_path":"/events/ante-up/2026-10-11-gridiron-boyertown-pa-1b48f1f3217e","off_site":false,"listed":true,"expires_on":"2027-01-09"},{"status":"Scheduled","date":"2026-10-04","title":"MUSICAL EQUIPMENT SWAP","admission_policy":{"with_adult":{"url":"https://www.anteupdenver.com/venue","reviewed_on":"2026-09-17","ranges":[{"min_age":0,"max_age":17,"condition":"Permitted at this age; sober space"}]},"text":"All ages; sober community space","url":"https://www.anteupdenver.com/venue","category":"All ages"},"event_url":"https://www.anteupdenver.com/events/musical-equipment-swap","ticket_url":"https://www.anteupdenver.com/events/musical-equipment-swap","id":"ante-up-31949a1e8801","upstream_id":"fa376c21-f03c-4f4d-974e-212b59d3ca1f","public_path":"/events/ante-up/2026-10-04-musical-equipment-swap-31949a1e8801","off_site":false,"listed":false,"expires_on":"2027-01-02"},{"status":"Scheduled","date":"2026-10-02","title":"FIRST FRIDAY- GALLERY + OPEN MIC","admission_policy":{"with_adult":{"url":"https://www.anteupdenver.com/venue","reviewed_on":"2026-09-17","ranges":[{"min_age":0,"max_age":17,"condition":"Permitted at this age; sober space"}]},"text":"All ages; sober community space","url":"https://www.anteupdenver.com/venue","category":"All ages"},"event_url":"https://www.anteupdenver.com/events/first-friday-gallery-open-mic-2","ticket_url":"https://www.anteupdenver.com/events/first-friday-gallery-open-mic-2","id":"ante-up-502f63a1eb6a","upstream_id":"c5009ddb-c79d-46d3-a845-eeb9d9f1042f","public_path":"/events/ante-up/2026-10-02-first-friday-gallery-open-mic-502f63a1eb6a","off_site":false,"listed":true,"expires_on":"2026-12-31"},{"status":"Scheduled","date":"2026-09-18","title":"SPITTING IMAGE - MARRIED TO MISERY TOUR KICKOFF","doors_at":"2026-09-18T19:00:00-06:00","show_at":"2026-09-18T19:30:00-06:00","admission_policy":{"with_adult":{"url":"https://www.anteupdenver.com/venue","reviewed_on":"2026-09-17","ranges":[{"min_age":0,"max_age":17,"condition":"Permitted at this age; sober space"}]},"text":"All ages; sober community space","url":"https://www.anteupdenver.com/venue","category":"All ages"},"event_url":"https://www.anteupdenver.com/events/spitting-image-married-to-misery-tour-kickoff","ticket_url":"https://www.anteupdenver.com/events/spitting-image-married-to-misery-tour-kickoff","id":"ante-up-547a920bee91","upstream_id":"1ebcc4de-4283-4ae5-a388-a3f9e67baf15","public_path":"/events/ante-up/2026-09-18-spitting-image-married-to-misery-tour-kickoff-547a920bee91","off_site":false,"listed":true,"expires_on":"2026-12-17"},{"status":"Scheduled","date":"2026-09-19","title":"MORTUDAEM","doors_at":"2026-09-19T18:00:00-06:00","show_at":"2026-09-19T19:00:00-06:00","admission_policy":{"with_adult":{"url":"https://www.anteupdenver.com/venue","reviewed_on":"2026-09-17","ranges":[{"min_age":0,"max_age":17,"condition":"Permitted at this age; sober space"}]},"text":"All ages; sober community space","url":"https://www.anteupdenver.com/venue","category":"All ages"},"event_url":"https://www.anteupdenver.com/events/mortudaem","ticket_url":"https://www.anteupdenver.com/events/mortudaem","id":"ante-up-577337b70a4d","upstream_id":"68300e92-3c1d-4b3c-ac0d-d0cbb832f60d","public_path":"/events/ante-up/2026-09-19-mortudaem-577337b70a4d","off_site":false,"listed":true,"expires_on":"2026-12-18"},{"status":"Scheduled","date":"2026-09-17","title":"EYES OF SALT","doors_at":"2026-09-17T19:00:00-06:00","show_at":"2026-09-17T19:30:00-06:00","admission_policy":{"with_adult":{"url":"https://www.anteupdenver.com/venue","reviewed_on":"2026-09-17","ranges":[{"min_age":0,"max_age":17,"condition":"Permitted at this age; sober space"}]},"text":"All ages; sober community space","url":"https://www.anteupdenver.com/venue","category":"All ages"},"event_url":"https://www.anteupdenver.com/events/eyes-of-salt","ticket_url":"https://www.anteupdenver.com/events/eyes-of-salt","id":"ante-up-8edf119b78cd","upstream_id":"749cbc4f-0c62-4fec-ba2f-4042763dda28","public_path":"/events/ante-up/2026-09-17-eyes-of-salt-8edf119b78cd","off_site":false,"listed":true,"expires_on":"2026-12-16"},{"status":"Scheduled","date":"2026-09-26","title":"FINAL BLOW","doors_at":"2026-09-26T19:00:00-06:00","show_at":"2026-09-26T19:30:00-06:00","admission_policy":{"with_adult":{"url":"https://www.anteupdenver.com/venue","reviewed_on":"2026-09-17","ranges":[{"min_age":0,"max_age":17,"condition":"Permitted at this age; sober space"}]},"text":"All ages; sober community space","url":"https://www.anteupdenver.com/venue","category":"All ages"},"event_url":"https://www.anteupdenver.com/events/final-blow","ticket_url":"https://www.anteupdenver.com/events/final-blow","id":"ante-up-a732840199ab","upstream_id":"50b975f7-f4b5-490e-94c0-fc802e61328f","public_path":"/events/ante-up/2026-09-26-final-blow-a732840199ab","off_site":false,"listed":true,"expires_on":"2026-12-25"},{"status":"Scheduled","date":"2026-10-18","title":"MAKERS' MATINEE - DENVER VINTAGE REGGAE SOCIETY","show_at":"2026-10-18T14:00:00-06:00","admission_policy":{"with_adult":{"url":"https://www.anteupdenver.com/venue","reviewed_on":"2026-09-17","ranges":[{"min_age":0,"max_age":17,"condition":"Permitted at this age; sober space"}]},"text":"All ages; sober community space","url":"https://www.anteupdenver.com/venue","category":"All ages"},"event_url":"https://www.anteupdenver.com/events/makers-matinee-denver-vintage-reggae-society","ticket_url":"https://www.anteupdenver.com/events/makers-matinee-denver-vintage-reggae-society","id":"ante-up-b6a150663064","upstream_id":"924c0b43-fe18-472a-88b8-01d362e36053","public_path":"/events/ante-up/2026-10-18-makers-matinee-denver-vintage-reggae-society-b6a150663064","off_site":false,"listed":true,"expires_on":"2027-01-16"},{"status":"Scheduled","date":"2026-10-10","title":"OPEN TRENCH","doors_at":"2026-10-10T18:30:00-06:00","show_at":"2026-10-10T19:00:00-06:00","admission_policy":{"with_adult":{"url":"https://www.anteupdenver.com/venue","reviewed_on":"2026-09-17","ranges":[{"min_age":0,"max_age":17,"condition":"Permitted at this age; sober space"}]},"text":"All ages; sober community space","url":"https://www.anteupdenver.com/venue","category":"All ages"},"event_url":"https://www.anteupdenver.com/events/open-trench","ticket_url":"https://www.anteupdenver.com/events/open-trench","id":"ante-up-d26b048cf674","upstream_id":"4c93f8ef-4262-4756-b8a5-657ce72809da","public_path":"/events/ante-up/2026-10-10-open-trench-d26b048cf674","off_site":false,"listed":true,"expires_on":"2027-01-08"},{"status":"Scheduled","date":"2026-10-18","title":"MAKERS' MARKET + CAR SHOW + MATINEE","admission_policy":{"with_adult":{"url":"https://www.anteupdenver.com/venue","reviewed_on":"2026-09-17","ranges":[{"min_age":0,"max_age":17,"condition":"Permitted at this age; sober space"}]},"text":"All ages; sober community space","url":"https://www.anteupdenver.com/venue","category":"All ages"},"event_url":"https://www.anteupdenver.com/events/makers-market-car-show-matinee","ticket_url":"https://www.anteupdenver.com/events/makers-market-car-show-matinee","id":"ante-up-f9993dd5115e","upstream_id":"c5367f54-ae4e-40d6-8cfb-88ed789b726c","public_path":"/events/ante-up/2026-10-18-makers-market-car-show-matinee-f9993dd5115e","off_site":false,"listed":true,"expires_on":"2027-01-16"}]}
