{"schema_version":1,"source":{"id":"levitt","adapter":"venuepilot"},"venue":{"key":"levitt","name":"Levitt Pavilion Denver","timezone":"America/Denver","website":"https://www.levittdenver.org","admission_policy":{"text":"Check event admission requirements; guests 16 and younger must have an adult","url":"https://www.levittdenver.org/faq"}},"generated_at":"2026-09-13T20:48:41.21Z","coverage":{"from":"2026-09-13","through":"2027-09-13","complete":true},"events":[{"status":"Scheduled","date":"2026-09-13","title":"Gamelan Tunas Mekar presents Pasar Southeast Asia","doors_at":"2026-09-13T16:00:00-06:00","show_at":"2026-09-13T16:30:00-06:00","admission_policy":{"with_adult":{"url":"https://www.levittdenver.org/faq","reviewed_on":"2026-09-11","ranges":[{"min_age":0,"max_age":16,"condition":"Adult required; event ticket requirements apply"},{"min_age":17,"max_age":17,"condition":"Event ticket requirements apply"}]},"text":"All ages","url":"https://www.levittdenver.org/summer-concert-series#/events/176331","category":"All ages"},"event_url":"https://www.levittdenver.org/summer-concert-series#/events/176331","ticket_url":"https://tickets.venuepilot.com/e/gamelan-tunas-mekar-2026-09-13-levitt-pavilion-denver-denver-b027b4","id":"levitt-39c2a96813e7","upstream_id":"176331","public_path":"/events/levitt/2026-09-13-gamelan-tunas-mekar-presents-pasar-southeast-asia-39c2a96813e7","off_site":false,"listed":true,"expires_on":"2026-12-12"},{"status":"Scheduled","date":"2026-10-01","title":"Rez Metal with Soulfly, Nailbomb, Incite, Project BC, Clay \u0026 Fire, and Hell Throne","doors_at":"2026-10-01T17:30:00-06:00","show_at":"2026-10-01T18:00:00-06:00","admission_policy":{"with_adult":{"url":"https://www.levittdenver.org/faq","reviewed_on":"2026-09-11","ranges":[{"min_age":0,"max_age":16,"condition":"Adult required; event ticket requirements apply"},{"min_age":17,"max_age":17,"condition":"Event ticket requirements apply"}]},"text":"All ages","url":"https://www.levittdenver.org/summer-concert-series#/events/176481","category":"All ages"},"event_url":"https://www.levittdenver.org/summer-concert-series#/events/176481","ticket_url":"https://tickets.venuepilot.com/e/rez-metal-2026-09-25-levitt-pavilion-denver-denver-7c6947","id":"levitt-48b72dadd33e","upstream_id":"176481","public_path":"/events/levitt/2026-10-01-rez-metal-with-soulfly-nailbomb-incite-project-bc-clay-fire-and-hell-throne-48b72dadd33e","off_site":false,"listed":true,"expires_on":"2026-12-30"},{"status":"Scheduled","date":"2026-10-03","title":"Colorado Free Jam ft. Grahame Lesh \u0026 Friends","doors_at":"2026-10-03T18:00:00-06:00","show_at":"2026-10-03T19:00:00-06:00","admission_policy":{"with_adult":{"url":"https://www.levittdenver.org/faq","reviewed_on":"2026-09-11","ranges":[{"min_age":0,"max_age":16,"condition":"Adult required; event ticket requirements apply"},{"min_age":17,"max_age":17,"condition":"Event ticket requirements apply"}]},"text":"All ages","url":"https://www.levittdenver.org/summer-concert-series#/events/193418","category":"All ages"},"event_url":"https://www.levittdenver.org/summer-concert-series#/events/193418","ticket_url":"https://t.venuepilot.com/e/colorado-free-jam-ft-grahame-lesh-friends-2026-10-03-levitt-pavilion-denver-denver-d1ca5b","id":"levitt-757e4665e566","upstream_id":"193418","public_path":"/events/levitt/2026-10-03-colorado-free-jam-ft-grahame-lesh-friends-757e4665e566","off_site":false,"listed":true,"expires_on":"2027-01-01"},{"status":"Scheduled","date":"2026-09-18","title":"La Santa Cecilia with Verena","doors_at":"2026-09-18T18:00:00-06:00","show_at":"2026-09-18T19:00:00-06:00","admission_policy":{"with_adult":{"url":"https://www.levittdenver.org/faq","reviewed_on":"2026-09-11","ranges":[{"min_age":0,"max_age":16,"condition":"Adult required; event ticket requirements apply"},{"min_age":17,"max_age":17,"condition":"Event ticket requirements apply"}]},"text":"All ages","url":"https://www.levittdenver.org/summer-concert-series#/events/166386","category":"All ages"},"event_url":"https://www.levittdenver.org/summer-concert-series#/events/166386","ticket_url":"https://tickets.venuepilot.com/e/la-santa-cecilia-2026-09-18-levitt-pavilion-denver-denver-24f293","id":"levitt-7d3c689bd2fe","upstream_id":"166386","public_path":"/events/levitt/2026-09-18-la-santa-cecilia-with-verena-7d3c689bd2fe","off_site":false,"listed":true,"expires_on":"2026-12-17"},{"status":"Scheduled","date":"2026-10-10","title":"Great American Beer Festival","doors_at":"2026-10-10T12:00:00-06:00","show_at":"2026-10-10T12:00:00-06:00","admission_policy":{"text":"21+","url":"https://www.levittdenver.org/summer-concert-series#/events/181906","category":"21+"},"event_url":"https://www.levittdenver.org/summer-concert-series#/events/181906","ticket_url":"https://www.eventbrite.com/e/great-american-beer-festival-2026-tickets-1989111395730?aff=levittpavilion","id":"levitt-9c7aaed639a0","upstream_id":"181906","public_path":"/events/levitt/2026-10-10-great-american-beer-festival-9c7aaed639a0","off_site":false,"listed":true,"expires_on":"2027-01-08"},{"status":"Scheduled","date":"2026-09-12","title":"Yoga on the Lawn","doors_at":"2026-09-12T09:00:00-06:00","show_at":"2026-09-12T09:00:00-06:00","admission_policy":{"with_adult":{"url":"https://www.levittdenver.org/faq","reviewed_on":"2026-09-11","ranges":[{"min_age":0,"max_age":16,"condition":"Adult required; event ticket requirements apply"},{"min_age":17,"max_age":17,"condition":"Event ticket requirements apply"}]},"text":"All ages","url":"https://www.levittdenver.org/summer-concert-series#/events/182686","category":"All ages"},"event_url":"https://www.levittdenver.org/summer-concert-series#/events/182686","ticket_url":"https://t.venuepilot.com/e/yoga-on-the-lawn-2026-09-12-levitt-pavilion-denver-denver-3f50cf","id":"levitt-b11ea62c3e69","upstream_id":"182686","public_path":"/events/levitt/2026-09-12-yoga-on-the-lawn-b11ea62c3e69","off_site":false,"listed":true,"expires_on":"2026-12-11"},{"status":"Scheduled","date":"2026-09-12","title":"Cool Vibes Reggae Fest with The Wailers","doors_at":"2026-09-12T16:00:00-06:00","show_at":"2026-09-12T17:00:00-06:00","admission_policy":{"with_adult":{"url":"https://www.levittdenver.org/faq","reviewed_on":"2026-09-11","ranges":[{"min_age":0,"max_age":16,"condition":"Adult required; event ticket requirements apply"},{"min_age":17,"max_age":17,"condition":"Event ticket requirements apply"}]},"text":"All ages","url":"https://www.levittdenver.org/summer-concert-series#/events/176477","category":"All ages"},"event_url":"https://www.levittdenver.org/summer-concert-series#/events/176477","ticket_url":"https://tickets.venuepilot.com/e/cool-vibes-reggae-fest-2026-09-12-levitt-pavilion-denver-denver-f8932b","id":"levitt-b35c2233a335","upstream_id":"176477","public_path":"/events/levitt/2026-09-12-cool-vibes-reggae-fest-with-the-wailers-b35c2233a335","off_site":false,"listed":true,"expires_on":"2026-12-11"},{"status":"Scheduled","date":"2026-09-19","title":"Yoga on the Lawn","doors_at":"2026-09-19T09:00:00-06:00","show_at":"2026-09-19T09:00:00-06:00","admission_policy":{"with_adult":{"url":"https://www.levittdenver.org/faq","reviewed_on":"2026-09-11","ranges":[{"min_age":0,"max_age":16,"condition":"Adult required; event ticket requirements apply"},{"min_age":17,"max_age":17,"condition":"Event ticket requirements apply"}]},"text":"All ages","url":"https://www.levittdenver.org/summer-concert-series#/events/182687","category":"All ages"},"event_url":"https://www.levittdenver.org/summer-concert-series#/events/182687","ticket_url":"https://t.venuepilot.com/e/yoga-on-the-lawn-2026-09-19-levitt-pavilion-denver-denver-78a37d","id":"levitt-b560ff1ee5e1","upstream_id":"182687","public_path":"/events/levitt/2026-09-19-yoga-on-the-lawn-b560ff1ee5e1","off_site":false,"listed":true,"expires_on":"2026-12-18"},{"status":"Scheduled","date":"2026-10-11","title":"Great American Beer Festival","doors_at":"2026-10-11T12:00:00-06:00","show_at":"2026-10-11T12:00:00-06:00","admission_policy":{"text":"21+","url":"https://www.levittdenver.org/summer-concert-series#/events/181907","category":"21+"},"event_url":"https://www.levittdenver.org/summer-concert-series#/events/181907","ticket_url":"https://www.eventbrite.com/e/great-american-beer-festival-2026-tickets-1989111395730?aff=levittpavilion","id":"levitt-c95db7adb770","upstream_id":"181907","public_path":"/events/levitt/2026-10-11-great-american-beer-festival-c95db7adb770","off_site":false,"listed":true,"expires_on":"2027-01-09"},{"status":"Scheduled","date":"2026-09-20","title":"Japan Fest with JA-NE Cultural Mixtape","doors_at":"2026-09-20T16:00:00-06:00","show_at":"2026-09-20T17:00:00-06:00","admission_policy":{"with_adult":{"url":"https://www.levittdenver.org/faq","reviewed_on":"2026-09-11","ranges":[{"min_age":0,"max_age":16,"condition":"Adult required; event ticket requirements apply"},{"min_age":17,"max_age":17,"condition":"Event ticket requirements apply"}]},"text":"All ages","url":"https://www.levittdenver.org/summer-concert-series#/events/176480","category":"All ages"},"event_url":"https://www.levittdenver.org/summer-concert-series#/events/176480","ticket_url":"https://tickets.venuepilot.com/e/japan-fest-2026-09-20-levitt-pavilion-denver-denver-a9cf09","id":"levitt-db25e5961fe3","upstream_id":"176480","public_path":"/events/levitt/2026-09-20-japan-fest-with-ja-ne-cultural-mixtape-db25e5961fe3","off_site":false,"listed":true,"expires_on":"2026-12-19"}]}
