{"schema_version":1,"source":{"id":"seventh-circle","adapter":"html-seventh-circle"},"venue":{"key":"seventh-circle","name":"Seventh Circle Music Collective","timezone":"America/Denver","website":"https://www.7thcirclemusiccollective.org","admission_policy":{"text":"All ages","url":"https://www.7thcirclemusiccollective.org/home/about","category":"All ages"}},"generated_at":"2026-10-02T19:21:28.423Z","coverage":{"from":"2026-10-02","through":"2027-10-02","complete":true},"events":[{"status":"Scheduled","date":"2026-10-13","title":"Sam Woodhouse, Axe Bunny, Jun Raine","admission_policy":{"with_adult":{"url":"https://www.7thcirclemusiccollective.org/home/about","reviewed_on":"2026-09-14","ranges":[{"min_age":0,"max_age":17,"condition":"$5 annual fee; show donations encouraged"}]},"text":"All ages","url":"https://www.7thcirclemusiccollective.org/home/about","category":"All ages"},"event_url":"https://www.7thcirclemusiccollective.org/posts/2470","id":"seventh-circle-0f305d614e47","upstream_id":"2470","public_path":"/events/seventh-circle/2026-10-13-sam-woodhouse-axe-bunny-jun-raine-0f305d614e47","off_site":false,"listed":true,"expires_on":"2027-01-11"},{"status":"Scheduled","date":"2026-10-09","title":"Ceramik, Chain Law, Hostile Takeover, Skarlet","admission_policy":{"with_adult":{"url":"https://www.7thcirclemusiccollective.org/home/about","reviewed_on":"2026-09-14","ranges":[{"min_age":0,"max_age":17,"condition":"$5 annual fee; show donations encouraged"}]},"text":"All ages","url":"https://www.7thcirclemusiccollective.org/home/about","category":"All ages"},"event_url":"https://www.7thcirclemusiccollective.org/posts/2469","id":"seventh-circle-38cc22c0579d","upstream_id":"2469","public_path":"/events/seventh-circle/2026-10-09-ceramik-chain-law-hostile-takeover-skarlet-38cc22c0579d","off_site":false,"listed":true,"expires_on":"2027-01-07"},{"status":"Scheduled","date":"2026-10-31","title":"Jake G., Buddy Bench, Open Trench, Green Scheme","admission_policy":{"with_adult":{"url":"https://www.7thcirclemusiccollective.org/home/about","reviewed_on":"2026-09-14","ranges":[{"min_age":0,"max_age":17,"condition":"$5 annual fee; show donations encouraged"}]},"text":"All ages","url":"https://www.7thcirclemusiccollective.org/home/about","category":"All ages"},"event_url":"https://www.7thcirclemusiccollective.org/posts/2462","id":"seventh-circle-4ab838aba04e","upstream_id":"2462","public_path":"/events/seventh-circle/2026-10-31-jake-g-buddy-bench-open-trench-green-scheme-4ab838aba04e","off_site":false,"listed":true,"expires_on":"2027-01-29"},{"status":"Scheduled","date":"2026-10-05","title":"HIRS COLLECTIVE, FATALIST, CACOPHONY, BONSAI","admission_policy":{"with_adult":{"url":"https://www.7thcirclemusiccollective.org/home/about","reviewed_on":"2026-09-14","ranges":[{"min_age":0,"max_age":17,"condition":"$5 annual fee; show donations encouraged"}]},"text":"All ages","url":"https://www.7thcirclemusiccollective.org/home/about","category":"All ages"},"event_url":"https://www.7thcirclemusiccollective.org/posts/2459","id":"seventh-circle-75890981628c","upstream_id":"2459","public_path":"/events/seventh-circle/2026-10-05-hirs-collective-fatalist-cacophony-bonsai-75890981628c","off_site":false,"listed":true,"expires_on":"2027-01-03"},{"status":"Scheduled","date":"2026-10-17","title":"Barry Osborne, Laura Goldhamer, Sam Armstrong-Zickefoose","admission_policy":{"with_adult":{"url":"https://www.7thcirclemusiccollective.org/home/about","reviewed_on":"2026-09-14","ranges":[{"min_age":0,"max_age":17,"condition":"$5 annual fee; show donations encouraged"}]},"text":"All ages","url":"https://www.7thcirclemusiccollective.org/home/about","category":"All ages"},"event_url":"https://www.7thcirclemusiccollective.org/posts/2460","id":"seventh-circle-79adfa4f92ca","upstream_id":"2460","public_path":"/events/seventh-circle/2026-10-17-barry-osborne-laura-goldhamer-sam-armstrong-zickefoose-79adfa4f92ca","off_site":false,"listed":true,"expires_on":"2027-01-15"},{"status":"Scheduled","date":"2026-10-29","title":"Pseudocrush, Radio Fry, Auxitone, Hostile Effect","admission_policy":{"with_adult":{"url":"https://www.7thcirclemusiccollective.org/home/about","reviewed_on":"2026-09-14","ranges":[{"min_age":0,"max_age":17,"condition":"$5 annual fee; show donations encouraged"}]},"text":"All ages","url":"https://www.7thcirclemusiccollective.org/home/about","category":"All ages"},"event_url":"https://www.7thcirclemusiccollective.org/posts/2467","id":"seventh-circle-85103c485b0f","upstream_id":"2467","public_path":"/events/seventh-circle/2026-10-29-pseudocrush-radio-fry-auxitone-hostile-effect-85103c485b0f","off_site":false,"listed":true,"expires_on":"2027-01-27"},{"status":"Scheduled","date":"2026-10-26","title":"Velocity Garden, Porcelain Horses, Marcus Tenorio","admission_policy":{"with_adult":{"url":"https://www.7thcirclemusiccollective.org/home/about","reviewed_on":"2026-09-14","ranges":[{"min_age":0,"max_age":17,"condition":"$5 annual fee; show donations encouraged"}]},"text":"All ages","url":"https://www.7thcirclemusiccollective.org/home/about","category":"All ages"},"event_url":"https://www.7thcirclemusiccollective.org/posts/2466","id":"seventh-circle-8b7c8886dcda","upstream_id":"2466","public_path":"/events/seventh-circle/2026-10-26-velocity-garden-porcelain-horses-marcus-tenorio-8b7c8886dcda","off_site":false,"listed":true,"expires_on":"2027-01-24"},{"status":"Scheduled","date":"2026-09-18","title":"New Moon, Caps Lock, Wood Nymph","admission_policy":{"with_adult":{"url":"https://www.7thcirclemusiccollective.org/home/about","reviewed_on":"2026-09-14","ranges":[{"min_age":0,"max_age":17,"condition":"$5 annual fee; show donations encouraged"}]},"text":"All ages","url":"https://www.7thcirclemusiccollective.org/home/about","category":"All ages"},"event_url":"https://www.7thcirclemusiccollective.org/posts/2457","id":"seventh-circle-8f548e8372b5","upstream_id":"2457","public_path":"/events/seventh-circle/2026-09-18-new-moon-caps-lock-wood-nymph-8f548e8372b5","off_site":false,"listed":true,"expires_on":"2026-12-17"},{"status":"Scheduled","date":"2026-10-18","title":"Stars don't mean anything, Ambretta, Pocket Angel, Fainting Dreams, athousandangelsandseven","admission_policy":{"with_adult":{"url":"https://www.7thcirclemusiccollective.org/home/about","reviewed_on":"2026-09-14","ranges":[{"min_age":0,"max_age":17,"condition":"$5 annual fee; show donations encouraged"}]},"text":"All ages","url":"https://www.7thcirclemusiccollective.org/home/about","category":"All ages"},"event_url":"https://www.7thcirclemusiccollective.org/posts/2451","id":"seventh-circle-b9cbfd81f7e8","upstream_id":"2451","public_path":"/events/seventh-circle/2026-10-18-stars-don-t-mean-anything-ambretta-pocket-angel-fainting-dreams-athousandangelsandseven-b9cbfd81f7e8","off_site":false,"listed":true,"expires_on":"2027-01-16"},{"status":"Scheduled","date":"2026-09-19","title":"Wytch, Funscreen, Axe Bunny, Lost Companion","doors_at":"2026-09-19T18:00:00-06:00","admission_policy":{"with_adult":{"url":"https://www.7thcirclemusiccollective.org/home/about","reviewed_on":"2026-09-14","ranges":[{"min_age":0,"max_age":17,"condition":"$5 annual fee; show donations encouraged"}]},"text":"All ages","url":"https://www.7thcirclemusiccollective.org/home/about","category":"All ages"},"event_url":"https://www.7thcirclemusiccollective.org/posts/2450","id":"seventh-circle-c6ae2bb51fb9","upstream_id":"2450","public_path":"/events/seventh-circle/2026-09-19-wytch-funscreen-axe-bunny-lost-companion-c6ae2bb51fb9","off_site":false,"listed":true,"expires_on":"2026-12-18"},{"status":"Scheduled","date":"2026-10-19","title":"Ethereal Moon, Victim of Fire, Vitriolic Withering, Darconigan","admission_policy":{"with_adult":{"url":"https://www.7thcirclemusiccollective.org/home/about","reviewed_on":"2026-09-14","ranges":[{"min_age":0,"max_age":17,"condition":"$5 annual fee; show donations encouraged"}]},"text":"All ages","url":"https://www.7thcirclemusiccollective.org/home/about","category":"All ages"},"event_url":"https://www.7thcirclemusiccollective.org/posts/2461","id":"seventh-circle-dc7d98ce6408","upstream_id":"2461","public_path":"/events/seventh-circle/2026-10-19-ethereal-moon-victim-of-fire-vitriolic-withering-darconigan-dc7d98ce6408","off_site":false,"listed":true,"expires_on":"2027-01-17"},{"status":"Scheduled","date":"2026-10-04","title":"Gopher Guts, Hostile Effect, New Moon, Woodnymph","admission_policy":{"with_adult":{"url":"https://www.7thcirclemusiccollective.org/home/about","reviewed_on":"2026-09-14","ranges":[{"min_age":0,"max_age":17,"condition":"$5 annual fee; show donations encouraged"}]},"text":"All ages","url":"https://www.7thcirclemusiccollective.org/home/about","category":"All ages"},"event_url":"https://www.7thcirclemusiccollective.org/posts/2465","id":"seventh-circle-e0cb21f9e362","upstream_id":"2465","public_path":"/events/seventh-circle/2026-10-04-gopher-guts-hostile-effect-new-moon-woodnymph-e0cb21f9e362","off_site":false,"listed":true,"expires_on":"2027-01-02"}]}
